IP 0.0.0.0.68 > 255.255.255.255.67: BOOTP/DHCP, Request from 00:08:02:1c:47:ae, length 322
IP 10.5.14.1.67 > 10.5.14.102.68: BOOTP/DHCP, Reply, length 300
IP 10.5.14.102 > 224.0.0.22: igmp v3 report, 1 group record(s)
IP 10.5.14.102 > 224.0.0.22: igmp v3 report, 1 group record(s)
IP 10.5.14.102 > 224.0.0.22: igmp v3 report, 1 group record(s)
IP 10.5.14.102 > 224.0.0.22: igmp v3 report, 1 group record(s)
IP 10.5.14.102.5353 > 224.0.0.251.5353: 0 ANY (QM)? DESKTOP-XNQA4Z1.local. (39)
IP 10.5.14.102.5353 > 224.0.0.251.5353: 0*- [0q] 1/0/0 A 10.5.14.102 (49)
IP 10.5.14.102.63929 > 224.0.0.252.5355: UDP, length 33
IP 10.5.14.102 > 224.0.0.22: igmp v3 report, 2 group record(s)
IP 10.5.14.102.57104 > 10.5.14.1.53: 40681+ A? dns.msftncsi.com. (34)
IP 10.5.14.102.63713 > 10.5.14.1.53: 54290+ A? wpad.localdomain. (34)
IP 10.5.14.1.53 > 10.5.14.102.57104: 40681 1/0/0 A 131.107.255.255 (50)
IP 10.5.14.102.137 > 10.5.14.1.137: UDP, length 68
IP 10.5.14.102.137 > 10.5.14.1.137: UDP, length 68
IP 10.5.14.102.137 > 10.5.14.1.137: UDP, length 68
IP 10.5.14.102.63713 > 10.5.14.1.53: 54290+ A? wpad.localdomain. (34)
IP 10.5.14.102 > 224.0.0.22: igmp v3 report, 1 group record(s)
IP 10.5.14.102.137 > 10.5.14.1.137: UDP, length 68
IP 10.5.14.102.137 > 10.5.14.1.137: UDP, length 68
IP 10.5.14.102 > 224.0.0.22: igmp v3 report, 1 group record(s)
IP 10.5.14.102.137 > 10.5.14.1.137: UDP, length 68
IP 10.5.14.102.63713 > 10.5.14.1.53: 54290+ A? wpad.localdomain. (34)
IP 10.5.14.102.137 > 10.5.14.1.137: UDP, length 68
IP 10.5.14.102.137 > 10.5.14.1.137: UDP, length 68
IP 10.5.14.102.137 > 10.5.14.1.137: UDP, length 68
IP 10.5.14.102.137 > 10.5.14.255.137: UDP, length 68
IP 10.5.14.102.137 > 10.5.14.255.137: UDP, length 68
IP 10.5.14.102.50828 > 10.5.14.1.53: 26192+ A? www.bing.com. (30)
IP 10.5.14.102.64312 > 10.5.14.1.53: 36459+ A? l-ring.msedge.net. (35)
IP 10.5.14.102.50567 > 10.5.14.1.53: 24214+ A? fp-afd.azurefd.us. (35)
IP 10.5.14.102.52622 > 10.5.14.1.53: 17874+ A? fp-vs.azureedge.net. (37)
IP 10.5.14.102.53696 > 10.5.14.1.53: 30369+ A? k-ring.msedge.net. (35)
IP 10.5.14.102.61972 > 10.5.14.1.53: 5818+ A? t-ring.msedge.net. (35)
IP 10.5.14.1.53 > 10.5.14.102.64312: 36459 3/0/0 CNAME l-ring.l-9999.l-msedge.net., CNAME l-9999.l-msedge.net., A 13.107.42.254 (102)
IP 10.5.14.1.53 > 10.5.14.102.53696: 30369 3/0/0 CNAME k-ring.k-9999.k-msedge.net., CNAME k-9999.k-msedge.net., A 13.107.18.254 (102)
IP 10.5.14.102.49671 > 13.107.42.254.443: Flags [S], seq 2853382761, win 65535, options [mss 1460,nop,wscale 8,nop,nop,sackOK], length 0
IP 10.5.14.1.53 > 10.5.14.102.61972: 5818 3/0/0 CNAME t-ring.t-9999.t-msedge.net., CNAME t-9999.t-msedge.net., A 13.107.246.254 (102)
IP 10.5.14.102.49672 > 13.107.246.254.443: Flags [S], seq 1315271794, win 65535, options [mss 1460,nop,wscale 8,nop,nop,sackOK], length 0
IP 10.5.14.1.53 > 10.5.14.102.52622: 17874 3/0/0 CNAME fp-vs.ec.azureedge.net., CNAME cs9.wpc.v0cdn.net., A 72.21.81.200 (104)
IP 10.5.14.1.53 > 10.5.14.102.50828: 26192 4/0/0 CNAME a-0001.a-afdentry.net.trafficmanager.net., CNAME dual-a-0001.a-msedge.net., A 204.79.197.200, A 13.107.21.200 (151)
IP 10.5.14.102.49674 > 13.107.18.254.443: Flags [S], seq 3529165541, win 65535, options [mss 1460,nop,wscale 8,nop,nop,sackOK], length 0
IP 10.5.14.102.49673 > 204.79.197.200.443: Flags [S], seq 304634958, win 65535, options [mss 1460,nop,wscale 8,nop,nop,sackOK], length 0
IP 10.5.14.102.49675 > 204.79.197.200.443: Flags [S], seq 1307909498, win 65535, options [mss 1460,nop,wscale 8,nop,nop,sackOK], length 0
IP 10.5.14.102.56141 > 10.5.14.1.53: 37216+ A? b79b954ca0659ec4a967826b05e902af.clo.footprintdns.com. (71)
IP 10.5.14.102.49676 > 72.21.81.200.443: Flags [S], seq 4091692433, win 65535, options [mss 1460,nop,wscale 8,nop,nop,sackOK], length 0
IP 10.5.14.1.53 > 10.5.14.102.50567: 24214 4/0/0 CNAME t-0001.msedge.azure.us., CNAME eafd-defaultvips-3p-gov.usgovtrafficmanager.net., CNAME eafd-ffgov-sn01.elasticafd.msedge.azure.us., A 52.243.159.155 (187)
IP 10.5.14.102.49677 > 52.243.159.155.443: Flags [S], seq 1564848040, win 65535, options [mss 1460,nop,wscale 8,nop,nop,sackOK], length 0
IP 13.107.42.254.443 > 10.5.14.102.49671: Flags [S.], seq 254962375, ack 2853382762, win 64240, options [mss 1460], length 0
IP 13.107.246.254.443 > 10.5.14.102.49672: Flags [S.], seq 3044767543, ack 1315271795, win 64240, options [mss 1460], length 0
IP 10.5.14.102.49671 > 13.107.42.254.443: Flags [.], ack 1, win 65535, length 0
IP 10.5.14.102.49672 > 13.107.246.254.443: Flags [.], ack 1, win 65535, length 0
IP 72.21.81.200.443 > 10.5.14.102.49676: Flags [S.], seq 2823110417, ack 4091692434, win 64240, options [mss 1460], length 0
IP 204.79.197.200.443 > 10.5.14.102.49675: Flags [S.], seq 1147924115, ack 1307909499, win 64240, options [mss 1460], length 0
IP 204.79.197.200.443 > 10.5.14.102.49673: Flags [S.], seq 706956848, ack 304634959, win 64240, options [mss 1460], length 0
IP 10.5.14.102.49676 > 72.21.81.200.443: Flags [.], ack 1, win 65535, length 0
IP 10.5.14.102.49675 > 204.79.197.200.443: Flags [.], ack 1, win 65535, length 0
IP 10.5.14.102.49673 > 204.79.197.200.443: Flags [.], ack 1, win 65535, length 0
IP 10.5.14.102.137 > 10.5.14.255.137: UDP, length 68
IP 10.5.14.102.137 > 10.5.14.255.137: UDP, length 68
IP 13.107.18.254.443 > 10.5.14.102.49674: Flags [S.], seq 720394224, ack 3529165542, win 64240, options [mss 1460], length 0
IP 10.5.14.102.49674 > 13.107.18.254.443: Flags [.], ack 1, win 65535, length 0
IP 52.243.159.155.443 > 10.5.14.102.49677: Flags [S.], seq 1887748201, ack 1564848041, win 64240, options [mss 1460], length 0
IP 10.5.14.102.49677 > 52.243.159.155.443: Flags [.], ack 1, win 65535, length 0
IP 10.5.14.1.53 > 10.5.14.102.56141: 37216 2/0/0 CNAME mrs20prdapp01-canary.cloudapp.net., A 52.136.136.11 (134)
IP 10.5.14.102.49678 > 52.136.136.11.443: Flags [S], seq 91580024, win 65535, options [mss 1460,nop,wscale 8,nop,nop,sackOK], length 0
IP 10.5.14.102.49674 > 13.107.18.254.443: Flags [P.], seq 1:207, ack 1, win 65535, length 206
IP 13.107.18.254.443 > 10.5.14.102.49674: Flags [.], ack 207, win 64240, length 0
IP 10.5.14.102.49672 > 13.107.246.254.443: Flags [P.], seq 1:207, ack 1, win 65535, length 206
IP 13.107.246.254.443 > 10.5.14.102.49672: Flags [.], ack 207, win 64240, length 0
IP 10.5.14.102.49676 > 72.21.81.200.443: Flags [P.], seq 1:209, ack 1, win 65535, length 208
IP 72.21.81.200.443 > 10.5.14.102.49676: Flags [.], ack 209, win 64240, length 0
IP 10.5.14.102.49675 > 204.79.197.200.443: Flags [P.], seq 1:202, ack 1, win 65535, length 201
IP 204.79.197.200.443 > 10.5.14.102.49675: Flags [.], ack 202, win 64240, length 0
IP 10.5.14.102.49673 > 204.79.197.200.443: Flags [P.], seq 1:202, ack 1, win 65535, length 201
IP 204.79.197.200.443 > 10.5.14.102.49673: Flags [.], ack 202, win 64240, length 0
IP 10.5.14.102.49677 > 52.243.159.155.443: Flags [P.], seq 1:207, ack 1, win 65535, length 206
IP 52.243.159.155.443 > 10.5.14.102.49677: Flags [.], ack 207, win 64240, length 0
IP 10.5.14.102.49671 > 13.107.42.254.443: Flags [P.], seq 1:207, ack 1, win 65535, length 206
IP 13.107.42.254.443 > 10.5.14.102.49671: Flags [.], ack 207, win 64240, length 0
IP 72.21.81.200.443 > 10.5.14.102.49676: Flags [P.], seq 1:1383, ack 209, win 64240, length 1382
IP 72.21.81.200.443 > 10.5.14.102.49676: Flags [P.], seq 1383:2765, ack 209, win 64240, length 1382
IP 10.5.14.102.49676 > 72.21.81.200.443: Flags [.], ack 1383, win 65535, length 0
IP 72.21.81.200.443 > 10.5.14.102.49676: Flags [P.], seq 2765:4097, ack 209, win 64240, length 1332
IP 10.5.14.102.49676 > 72.21.81.200.443: Flags [.], ack 2765, win 65535, length 0
IP 10.5.14.102.49676 > 72.21.81.200.443: Flags [.], ack 4097, win 65535, length 0
IP 72.21.81.200.443 > 10.5.14.102.49676: Flags [P.], seq 4097:5479, ack 209, win 64240, length 1382
IP 72.21.81.200.443 > 10.5.14.102.49676: Flags [P.], seq 5479:6861, ack 209, win 64240, length 1382
IP 72.21.81.200.443 > 10.5.14.102.49676: Flags [.], seq 6861:8321, ack 209, win 64240, length 1460
IP 72.21.81.200.443 > 10.5.14.102.49676: Flags [P.], seq 8321:8383, ack 209, win 64240, length 62
IP 204.79.197.200.443 > 10.5.14.102.49675: Flags [P.], seq 1:1383, ack 202, win 64240, length 1382
IP 204.79.197.200.443 > 10.5.14.102.49675: Flags [P.], seq 1383:2765, ack 202, win 64240, length 1382
IP 10.5.14.102.49676 > 72.21.81.200.443: Flags [.], ack 8383, win 65535, length 0
IP 10.5.14.102.49675 > 204.79.197.200.443: Flags [.], ack 1383, win 65535, length 0
IP 204.79.197.200.443 > 10.5.14.102.49675: Flags [P.], seq 2765:4147, ack 202, win 64240, length 1382
IP 10.5.14.102.49675 > 204.79.197.200.443: Flags [.], ack 4147, win 65535, length 0
IP 204.79.197.200.443 > 10.5.14.102.49675: Flags [P.], seq 4147:5529, ack 202, win 64240, length 1382
IP 204.79.197.200.443 > 10.5.14.102.49675: Flags [P.], seq 5529:6911, ack 202, win 64240, length 1382
IP 10.5.14.102.49675 > 204.79.197.200.443: Flags [.], ack 6911, win 65535, length 0
IP 204.79.197.200.443 > 10.5.14.102.49675: Flags [P.], seq 6911:7375, ack 202, win 64240, length 464
IP 204.79.197.200.443 > 10.5.14.102.49673: Flags [P.], seq 1:1383, ack 202, win 64240, length 1382
IP 10.5.14.102.49675 > 204.79.197.200.443: Flags [.], ack 7375, win 65535, length 0
IP 10.5.14.102.49673 > 204.79.197.200.443: Flags [.], ack 1383, win 65535, length 0
IP 204.79.197.200.443 > 10.5.14.102.49673: Flags [P.], seq 1383:2765, ack 202, win 64240, length 1382
IP 10.5.14.102.49673 > 204.79.197.200.443: Flags [.], ack 2765, win 65535, length 0
IP 204.79.197.200.443 > 10.5.14.102.49673: Flags [P.], seq 2765:4147, ack 202, win 64240, length 1382
IP 10.5.14.102.49673 > 204.79.197.200.443: Flags [.], ack 4147, win 65535, length 0
IP 204.79.197.200.443 > 10.5.14.102.49673: Flags [.], seq 4147:5607, ack 202, win 64240, length 1460
IP 204.79.197.200.443 > 10.5.14.102.49673: Flags [.], seq 5607:7067, ack 202, win 64240, length 1460
IP 204.79.197.200.443 > 10.5.14.102.49673: Flags [P.], seq 7067:7375, ack 202, win 64240, length 308
IP 10.5.14.102.49673 > 204.79.197.200.443: Flags [.], ack 7375, win 65535, length 0
IP 13.107.246.254.443 > 10.5.14.102.49672: Flags [P.], seq 1:1383, ack 207, win 64240, length 1382
IP 10.5.14.102.49672 > 13.107.246.254.443: Flags [.], ack 1383, win 65535, length 0
IP 13.107.246.254.443 > 10.5.14.102.49672: Flags [P.], seq 1383:2765, ack 207, win 64240, length 1382
IP 13.107.246.254.443 > 10.5.14.102.49672: Flags [P.], seq 2765:4147, ack 207, win 64240, length 1382
IP 10.5.14.102.49672 > 13.107.246.254.443: Flags [.], ack 2765, win 65535, length 0
IP 10.5.14.102.49672 > 13.107.246.254.443: Flags [.], ack 4147, win 65535, length 0
IP 13.107.246.254.443 > 10.5.14.102.49672: Flags [.], seq 4147:5607, ack 207, win 64240, length 1460
IP 13.107.246.254.443 > 10.5.14.102.49672: Flags [P.], seq 5607:6331, ack 207, win 64240, length 724
IP 10.5.14.102.49672 > 13.107.246.254.443: Flags [.], ack 6331, win 65535, length 0
IP 13.107.42.254.443 > 10.5.14.102.49671: Flags [P.], seq 1:1383, ack 207, win 64240, length 1382
IP 10.5.14.102.49671 > 13.107.42.254.443: Flags [.], ack 1383, win 65535, length 0
IP 13.107.42.254.443 > 10.5.14.102.49671: Flags [P.], seq 1383:2765, ack 207, win 64240, length 1382
IP 10.5.14.102.49671 > 13.107.42.254.443: Flags [.], ack 2765, win 65535, length 0
IP 13.107.42.254.443 > 10.5.14.102.49671: Flags [P.], seq 2765:4147, ack 207, win 64240, length 1382
IP 10.5.14.102.49671 > 13.107.42.254.443: Flags [.], ack 4147, win 65535, length 0
IP 13.107.42.254.443 > 10.5.14.102.49671: Flags [.], seq 4147:5607, ack 207, win 64240, length 1460
IP 13.107.42.254.443 > 10.5.14.102.49671: Flags [P.], seq 5607:6335, ack 207, win 64240, length 728
IP 10.5.14.102.49671 > 13.107.42.254.443: Flags [.], ack 6335, win 65535, length 0
IP 52.243.159.155.443 > 10.5.14.102.49677: Flags [P.], seq 1:1383, ack 207, win 64240, length 1382
IP 10.5.14.102.49677 > 52.243.159.155.443: Flags [.], ack 1383, win 65535, length 0
IP 52.243.159.155.443 > 10.5.14.102.49677: Flags [P.], seq 1383:2765, ack 207, win 64240, length 1382
IP 10.5.14.102.49677 > 52.243.159.155.443: Flags [.], ack 2765, win 65535, length 0
IP 52.243.159.155.443 > 10.5.14.102.49677: Flags [P.], seq 2765:3850, ack 207, win 64240, length 1085
IP 10.5.14.102.49677 > 52.243.159.155.443: Flags [.], ack 3850, win 65535, length 0
IP 13.107.18.254.443 > 10.5.14.102.49674: Flags [P.], seq 1:1383, ack 207, win 64240, length 1382
IP 10.5.14.102.49674 > 13.107.18.254.443: Flags [.], ack 1383, win 65535, length 0
IP 13.107.18.254.443 > 10.5.14.102.49674: Flags [.], seq 1383:2843, ack 207, win 64240, length 1460
IP 13.107.18.254.443 > 10.5.14.102.49674: Flags [P.], seq 2843:4147, ack 207, win 64240, length 1304
IP 10.5.14.102.49674 > 13.107.18.254.443: Flags [.], ack 4147, win 65535, length 0
IP 13.107.18.254.443 > 10.5.14.102.49674: Flags [.], seq 4147:5607, ack 207, win 64240, length 1460
IP 13.107.18.254.443 > 10.5.14.102.49674: Flags [P.], seq 5607:6335, ack 207, win 64240, length 728
IP 10.5.14.102.49674 > 13.107.18.254.443: Flags [.], ack 6335, win 65535, length 0
IP 10.5.14.102.49675 > 204.79.197.200.443: Flags [P.], seq 202:360, ack 7375, win 65535, length 158
IP 204.79.197.200.443 > 10.5.14.102.49675: Flags [.], ack 360, win 64240, length 0
IP 10.5.14.102.49675 > 204.79.197.200.443: Flags [P.], seq 360:447, ack 7375, win 65535, length 87
IP 204.79.197.200.443 > 10.5.14.102.49675: Flags [.], ack 447, win 64240, length 0
IP 10.5.14.102.49675 > 204.79.197.200.443: Flags [P.], seq 447:1723, ack 7375, win 65535, length 1276
IP 204.79.197.200.443 > 10.5.14.102.49675: Flags [.], ack 1723, win 64240, length 0
IP 10.5.14.102.49677 > 52.243.159.155.443: Flags [P.], seq 207:365, ack 3850, win 65535, length 158
IP 52.243.159.155.443 > 10.5.14.102.49677: Flags [.], ack 365, win 64240, length 0
IP 10.5.14.102.49677 > 52.243.159.155.443: Flags [P.], seq 365:452, ack 3850, win 65535, length 87
IP 52.243.159.155.443 > 10.5.14.102.49677: Flags [.], ack 452, win 64240, length 0
IP 10.5.14.102.49673 > 204.79.197.200.443: Flags [P.], seq 202:360, ack 7375, win 65535, length 158
IP 204.79.197.200.443 > 10.5.14.102.49673: Flags [.], ack 360, win 64240, length 0
IP 10.5.14.102.49673 > 204.79.197.200.443: Flags [P.], seq 360:447, ack 7375, win 65535, length 87
IP 204.79.197.200.443 > 10.5.14.102.49673: Flags [.], ack 447, win 64240, length 0
IP 10.5.14.102.49676 > 72.21.81.200.443: Flags [P.], seq 209:335, ack 8383, win 65535, length 126
IP 72.21.81.200.443 > 10.5.14.102.49676: Flags [.], ack 335, win 64240, length 0
IP 10.5.14.102.49676 > 72.21.81.200.443: Flags [P.], seq 335:422, ack 8383, win 65535, length 87
IP 72.21.81.200.443 > 10.5.14.102.49676: Flags [.], ack 422, win 64240, length 0
IP 10.5.14.102.49674 > 13.107.18.254.443: Flags [P.], seq 207:365, ack 6335, win 65535, length 158
IP 10.5.14.102.49671 > 13.107.42.254.443: Flags [P.], seq 207:365, ack 6335, win 65535, length 158
IP 13.107.18.254.443 > 10.5.14.102.49674: Flags [.], ack 365, win 64240, length 0
IP 13.107.42.254.443 > 10.5.14.102.49671: Flags [.], ack 365, win 64240, length 0
IP 10.5.14.102.49674 > 13.107.18.254.443: Flags [P.], seq 365:452, ack 6335, win 65535, length 87
IP 10.5.14.102.49671 > 13.107.42.254.443: Flags [P.], seq 365:452, ack 6335, win 65535, length 87
IP 13.107.18.254.443 > 10.5.14.102.49674: Flags [.], ack 452, win 64240, length 0
IP 13.107.42.254.443 > 10.5.14.102.49671: Flags [.], ack 452, win 64240, length 0
IP 10.5.14.102.49672 > 13.107.246.254.443: Flags [P.], seq 207:365, ack 6331, win 65535, length 158
IP 13.107.246.254.443 > 10.5.14.102.49672: Flags [.], ack 365, win 64240, length 0
IP 10.5.14.102.49672 > 13.107.246.254.443: Flags [P.], seq 365:452, ack 6331, win 65535, length 87
IP 13.107.246.254.443 > 10.5.14.102.49672: Flags [.], ack 452, win 64240, length 0
IP 10.5.14.102.137 > 10.5.14.255.137: UDP, length 68
IP 52.136.136.11.443 > 10.5.14.102.49678: Flags [S.], seq 1324860675, ack 91580025, win 64240, options [mss 1460], length 0
IP 10.5.14.102.49678 > 52.136.136.11.443: Flags [.], ack 1, win 65535, length 0
IP 10.5.14.102.49678 > 52.136.136.11.443: Flags [P.], seq 1:243, ack 1, win 65535, length 242
IP 52.136.136.11.443 > 10.5.14.102.49678: Flags [.], ack 243, win 64240, length 0
IP 72.21.81.200.443 > 10.5.14.102.49676: Flags [P.], seq 8383:8751, ack 422, win 64240, length 368
IP 10.5.14.102.49676 > 72.21.81.200.443: Flags [.], ack 8751, win 65535, length 0
IP 204.79.197.200.443 > 10.5.14.102.49675: Flags [P.], seq 7375:7770, ack 1723, win 64240, length 395
IP 204.79.197.200.443 > 10.5.14.102.49673: Flags [P.], seq 7375:7770, ack 447, win 64240, length 395
IP 10.5.14.102.49675 > 204.79.197.200.443: Flags [.], ack 7770, win 65535, length 0
IP 10.5.14.102.49673 > 204.79.197.200.443: Flags [.], ack 7770, win 65535, length 0
IP 10.5.14.102.49676 > 72.21.81.200.443: Flags [P.], seq 422:460, ack 8751, win 65535, length 38
IP 72.21.81.200.443 > 10.5.14.102.49676: Flags [.], ack 460, win 64240, length 0
IP 10.5.14.102.49675 > 204.79.197.200.443: Flags [P.], seq 1723:1761, ack 7770, win 65535, length 38
IP 204.79.197.200.443 > 10.5.14.102.49675: Flags [.], ack 1761, win 64240, length 0
IP 13.107.246.254.443 > 10.5.14.102.49672: Flags [P.], seq 6331:6382, ack 452, win 64240, length 51
IP 10.5.14.102.49673 > 204.79.197.200.443: Flags [P.], seq 447:485, ack 7770, win 65535, length 38
IP 204.79.197.200.443 > 10.5.14.102.49673: Flags [.], ack 485, win 64240, length 0
IP 10.5.14.102.49672 > 13.107.246.254.443: Flags [.], ack 6382, win 65535, length 0
IP 13.107.246.254.443 > 10.5.14.102.49672: Flags [P.], seq 6382:6451, ack 452, win 64240, length 69
IP 13.107.42.254.443 > 10.5.14.102.49671: Flags [P.], seq 6335:6730, ack 452, win 64240, length 395
IP 13.107.18.254.443 > 10.5.14.102.49674: Flags [P.], seq 6335:6730, ack 452, win 64240, length 395
IP 10.5.14.102.49672 > 13.107.246.254.443: Flags [.], ack 6451, win 65535, length 0
IP 10.5.14.102.49671 > 13.107.42.254.443: Flags [.], ack 6730, win 65535, length 0
IP 10.5.14.102.49674 > 13.107.18.254.443: Flags [.], ack 6730, win 65535, length 0
IP 10.5.14.102.49672 > 13.107.246.254.443: Flags [P.], seq 452:490, ack 6451, win 65535, length 38
IP 13.107.246.254.443 > 10.5.14.102.49672: Flags [.], ack 490, win 64240, length 0
IP 10.5.14.102.49674 > 13.107.18.254.443: Flags [P.], seq 452:490, ack 6730, win 65535, length 38
IP 10.5.14.102.49671 > 13.107.42.254.443: Flags [P.], seq 452:490, ack 6730, win 65535, length 38
IP 13.107.18.254.443 > 10.5.14.102.49674: Flags [.], ack 490, win 64240, length 0
IP 13.107.42.254.443 > 10.5.14.102.49671: Flags [.], ack 490, win 64240, length 0
IP 52.243.159.155.443 > 10.5.14.102.49677: Flags [P.], seq 3850:3970, ack 452, win 64240, length 120
IP 10.5.14.102.49677 > 52.243.159.155.443: Flags [.], ack 3970, win 65535, length 0
IP 10.5.14.102.49677 > 52.243.159.155.443: Flags [P.], seq 452:490, ack 3970, win 65535, length 38
IP 52.243.159.155.443 > 10.5.14.102.49677: Flags [.], ack 490, win 64240, length 0
IP 204.79.197.200.443 > 10.5.14.102.49675: Flags [P.], seq 7770:7808, ack 1761, win 64240, length 38
IP 10.5.14.102.49675 > 204.79.197.200.443: Flags [.], ack 7808, win 65535, length 0
IP 204.79.197.200.443 > 10.5.14.102.49675: Flags [P.], seq 7808:9190, ack 1761, win 64240, length 1382
IP 204.79.197.200.443 > 10.5.14.102.49675: Flags [P.], seq 9190:10572, ack 1761, win 64240, length 1382
IP 10.5.14.102.49675 > 204.79.197.200.443: Flags [.], ack 9190, win 65535, length 0
IP 204.79.197.200.443 > 10.5.14.102.49675: Flags [P.], seq 10572:11763, ack 1761, win 64240, length 1191
IP 10.5.14.102.49675 > 204.79.197.200.443: Flags [.], ack 10572, win 65535, length 0
IP 204.79.197.200.443 > 10.5.14.102.49675: Flags [P.], seq 11763:13145, ack 1761, win 64240, length 1382
IP 10.5.14.102.49675 > 204.79.197.200.443: Flags [.], ack 13145, win 65535, length 0
IP 204.79.197.200.443 > 10.5.14.102.49675: Flags [P.], seq 13145:14527, ack 1761, win 64240, length 1382
IP 10.5.14.102.49675 > 204.79.197.200.443: Flags [.], ack 14527, win 65535, length 0
IP 204.79.197.200.443 > 10.5.14.102.49675: Flags [P.], seq 14527:15909, ack 1761, win 64240, length 1382
IP 10.5.14.102.49675 > 204.79.197.200.443: Flags [.], ack 15909, win 65535, length 0
IP 204.79.197.200.443 > 10.5.14.102.49675: Flags [P.], seq 15909:17291, ack 1761, win 64240, length 1382
IP 10.5.14.102.49675 > 204.79.197.200.443: Flags [.], ack 17291, win 65535, length 0
IP 204.79.197.200.443 > 10.5.14.102.49675: Flags [P.], seq 17291:18673, ack 1761, win 64240, length 1382
IP 10.5.14.102.49675 > 204.79.197.200.443: Flags [.], ack 18673, win 65535, length 0
IP 204.79.197.200.443 > 10.5.14.102.49675: Flags [P.], seq 18673:19993, ack 1761, win 64240, length 1320
IP 10.5.14.102.49675 > 204.79.197.200.443: Flags [.], ack 19993, win 65535, length 0
IP 204.79.197.200.443 > 10.5.14.102.49675: Flags [P.], seq 19993:21375, ack 1761, win 64240, length 1382
IP 10.5.14.102.49675 > 204.79.197.200.443: Flags [.], ack 21375, win 65535, length 0
IP 204.79.197.200.443 > 10.5.14.102.49675: Flags [P.], seq 21375:22757, ack 1761, win 64240, length 1382
IP 10.5.14.102.49675 > 204.79.197.200.443: Flags [.], ack 22757, win 65535, length 0
IP 204.79.197.200.443 > 10.5.14.102.49675: Flags [P.], seq 22757:24139, ack 1761, win 64240, length 1382
IP 10.5.14.102.49675 > 204.79.197.200.443: Flags [.], ack 24139, win 65535, length 0
IP 204.79.197.200.443 > 10.5.14.102.49675: Flags [P.], seq 24139:25521, ack 1761, win 64240, length 1382
IP 10.5.14.102.49675 > 204.79.197.200.443: Flags [.], ack 25521, win 65535, length 0
IP 204.79.197.200.443 > 10.5.14.102.49675: Flags [P.], seq 25521:26903, ack 1761, win 64240, length 1382
IP 10.5.14.102.49675 > 204.79.197.200.443: Flags [.], ack 26903, win 65535, length 0
IP 204.79.197.200.443 > 10.5.14.102.49675: Flags [P.], seq 26903:28223, ack 1761, win 64240, length 1320
IP 204.79.197.200.443 > 10.5.14.102.49675: Flags [P.], seq 28223:29605, ack 1761, win 64240, length 1382
IP 10.5.14.102.49675 > 204.79.197.200.443: Flags [.], ack 28223, win 65535, length 0
IP 10.5.14.102.49675 > 204.79.197.200.443: Flags [.], ack 29605, win 65535, length 0
IP 204.79.197.200.443 > 10.5.14.102.49675: Flags [P.], seq 29605:30987, ack 1761, win 64240, length 1382
IP 10.5.14.102.49675 > 204.79.197.200.443: Flags [.], ack 30987, win 65535, length 0
IP 204.79.197.200.443 > 10.5.14.102.49675: Flags [P.], seq 30987:32369, ack 1761, win 64240, length 1382
IP 10.5.14.102.49675 > 204.79.197.200.443: Flags [.], ack 32369, win 65535, length 0
IP 204.79.197.200.443 > 10.5.14.102.49675: Flags [P.], seq 32369:33751, ack 1761, win 64240, length 1382
IP 10.5.14.102.49675 > 204.79.197.200.443: Flags [.], ack 33751, win 65535, length 0
IP 204.79.197.200.443 > 10.5.14.102.49675: Flags [P.], seq 33751:35133, ack 1761, win 64240, length 1382
IP 72.21.81.200.443 > 10.5.14.102.49676: Flags [P.], seq 8751:8789, ack 460, win 64240, length 38
IP 204.79.197.200.443 > 10.5.14.102.49675: Flags [P.], seq 35133:36453, ack 1761, win 64240, length 1320
IP 10.5.14.102.49675 > 204.79.197.200.443: Flags [.], ack 36453, win 65535, length 0
IP 10.5.14.102.49676 > 72.21.81.200.443: Flags [.], ack 8789, win 65535, length 0
IP 204.79.197.200.443 > 10.5.14.102.49673: Flags [P.], seq 7770:7808, ack 485, win 64240, length 38
IP 13.107.246.254.443 > 10.5.14.102.49672: Flags [P.], seq 6451:6489, ack 490, win 64240, length 38
IP 13.107.42.254.443 > 10.5.14.102.49671: Flags [P.], seq 6730:6768, ack 490, win 64240, length 38
IP 13.107.18.254.443 > 10.5.14.102.49674: Flags [P.], seq 6730:6768, ack 490, win 64240, length 38
IP 10.5.14.102.49673 > 204.79.197.200.443: Flags [.], ack 7808, win 65535, length 0
IP 10.5.14.102.49672 > 13.107.246.254.443: Flags [.], ack 6489, win 65535, length 0
IP 10.5.14.102.49671 > 13.107.42.254.443: Flags [.], ack 6768, win 65535, length 0
IP 10.5.14.102.49674 > 13.107.18.254.443: Flags [.], ack 6768, win 65535, length 0
IP 52.243.159.155.443 > 10.5.14.102.49677: Flags [P.], seq 3970:4008, ack 490, win 64240, length 38
IP 204.79.197.200.443 > 10.5.14.102.49675: Flags [P.], seq 36453:37835, ack 1761, win 64240, length 1382
IP 204.79.197.200.443 > 10.5.14.102.49675: Flags [P.], seq 37835:39217, ack 1761, win 64240, length 1382
IP 10.5.14.102.49677 > 52.243.159.155.443: Flags [.], ack 4008, win 65535, length 0
IP 10.5.14.102.49675 > 204.79.197.200.443: Flags [.], ack 37835, win 65535, length 0
IP 204.79.197.200.443 > 10.5.14.102.49675: Flags [P.], seq 39217:40599, ack 1761, win 64240, length 1382
IP 10.5.14.102.49675 > 204.79.197.200.443: Flags [.], ack 40599, win 65535, length 0
IP 204.79.197.200.443 > 10.5.14.102.49675: Flags [P.], seq 40599:41981, ack 1761, win 64240, length 1382
IP 10.5.14.102.49675 > 204.79.197.200.443: Flags [.], ack 41981, win 65535, length 0
IP 204.79.197.200.443 > 10.5.14.102.49675: Flags [P.], seq 41981:43363, ack 1761, win 64240, length 1382
IP 10.5.14.102.49675 > 204.79.197.200.443: Flags [.], ack 43363, win 65535, length 0
IP 204.79.197.200.443 > 10.5.14.102.49675: Flags [P.], seq 43363:44745, ack 1761, win 64240, length 1382
IP 10.5.14.102.49675 > 204.79.197.200.443: Flags [.], ack 44745, win 65535, length 0
IP 204.79.197.200.443 > 10.5.14.102.49675: Flags [P.], seq 44745:46127, ack 1761, win 64240, length 1382
IP 10.5.14.102.49675 > 204.79.197.200.443: Flags [.], ack 46127, win 65535, length 0
IP 204.79.197.200.443 > 10.5.14.102.49675: Flags [.], seq 46127:47587, ack 1761, win 64240, length 1460
IP 204.79.197.200.443 > 10.5.14.102.49675: Flags [P.], seq 47587:48194, ack 1761, win 64240, length 607
IP 10.5.14.102.49675 > 204.79.197.200.443: Flags [.], ack 48194, win 65535, length 0
IP 52.136.136.11.443 > 10.5.14.102.49678: Flags [.], seq 1:1461, ack 243, win 64240, length 1460
IP 52.136.136.11.443 > 10.5.14.102.49678: Flags [P.], seq 1461:2741, ack 243, win 64240, length 1280
IP 52.136.136.11.443 > 10.5.14.102.49678: Flags [P.], seq 2741:4111, ack 243, win 64240, length 1370
IP 10.5.14.102.49678 > 52.136.136.11.443: Flags [.], ack 2741, win 65535, length 0
IP 52.136.136.11.443 > 10.5.14.102.49678: Flags [P.], seq 4111:5481, ack 243, win 64240, length 1370
IP 10.5.14.102.49678 > 52.136.136.11.443: Flags [.], ack 4111, win 65535, length 0
IP 52.136.136.11.443 > 10.5.14.102.49678: Flags [P.], seq 5481:5901, ack 243, win 64240, length 420
IP 10.5.14.102.49678 > 52.136.136.11.443: Flags [.], ack 5901, win 65535, length 0
IP 10.5.14.102.49678 > 52.136.136.11.443: Flags [P.], seq 243:336, ack 5901, win 65535, length 93
IP 52.136.136.11.443 > 10.5.14.102.49678: Flags [.], ack 336, win 64240, length 0
IP 10.5.14.102.49678 > 52.136.136.11.443: Flags [P.], seq 336:423, ack 5901, win 65535, length 87
IP 52.136.136.11.443 > 10.5.14.102.49678: Flags [.], ack 423, win 64240, length 0
IP 52.136.136.11.443 > 10.5.14.102.49678: Flags [P.], seq 5901:5952, ack 423, win 64240, length 51
IP 10.5.14.102.49678 > 52.136.136.11.443: Flags [.], ack 5952, win 65535, length 0
IP 52.136.136.11.443 > 10.5.14.102.49678: Flags [P.], seq 5952:6021, ack 423, win 64240, length 69
IP 10.5.14.102.49678 > 52.136.136.11.443: Flags [.], ack 6021, win 65535, length 0
IP 10.5.14.102.49678 > 52.136.136.11.443: Flags [P.], seq 423:461, ack 6021, win 65535, length 38
IP 52.136.136.11.443 > 10.5.14.102.49678: Flags [.], ack 461, win 64240, length 0
IP 10.5.14.102.137 > 10.5.14.255.137: UDP, length 68
IP 10.5.14.102.137 > 10.5.14.255.137: UDP, length 68
IP 10.5.14.102.49675 > 204.79.197.200.443: Flags [P.], seq 1761:2262, ack 48194, win 65535, length 501
IP 204.79.197.200.443 > 10.5.14.102.49675: Flags [.], ack 2262, win 64240, length 0
IP 10.5.14.102.49675 > 204.79.197.200.443: Flags [P.], seq 2262:2513, ack 48194, win 65535, length 251
IP 204.79.197.200.443 > 10.5.14.102.49675: Flags [.], ack 2513, win 64240, length 0
IP 10.5.14.102.49675 > 204.79.197.200.443: Flags [P.], seq 2513:3224, ack 48194, win 65535, length 711
IP 204.79.197.200.443 > 10.5.14.102.49675: Flags [.], ack 3224, win 64240, length 0
IP 10.5.14.102.49675 > 204.79.197.200.443: Flags [P.], seq 3224:3262, ack 48194, win 65535, length 38
IP 204.79.197.200.443 > 10.5.14.102.49675: Flags [.], ack 3262, win 64240, length 0
IP 52.136.136.11.443 > 10.5.14.102.49678: Flags [P.], seq 6021:6059, ack 461, win 64240, length 38
IP 10.5.14.102.49678 > 52.136.136.11.443: Flags [.], ack 6059, win 65535, length 0
IP 204.79.197.200.443 > 10.5.14.102.49675: Flags [P.], seq 48194:48367, ack 3262, win 64240, length 173
IP 10.5.14.102.49675 > 204.79.197.200.443: Flags [.], ack 48367, win 65535, length 0
IP 10.5.14.102.137 > 10.5.14.255.137: UDP, length 68
IP 204.79.197.200.443 > 10.5.14.102.49675: Flags [P.], seq 48367:48488, ack 3262, win 64240, length 121
IP 10.5.14.102.49675 > 204.79.197.200.443: Flags [.], ack 48488, win 65535, length 0
IP 10.5.14.102.137 > 10.5.14.255.137: UDP, length 68
IP 10.5.14.102.137 > 10.5.14.255.137: UDP, length 68
IP 10.5.14.102.137 > 10.5.14.255.137: UDP, length 68
IP 10.5.14.102.137 > 10.5.14.255.137: UDP, length 68
IP 10.5.14.102.138 > 10.5.14.255.138: UDP, length 201
IP 10.5.14.102.64395 > 10.5.14.1.53: 3029+ A? www.bing.com. (30)
IP 10.5.14.1.53 > 10.5.14.102.64395: 3029 4/0/0 CNAME a-0001.a-afdentry.net.trafficmanager.net., CNAME dual-a-0001.a-msedge.net., A 204.79.197.200, A 13.107.21.200 (151)
IP 10.5.14.102.49679 > 204.79.197.200.443: Flags [S], seq 2430004295, win 65535, options [mss 1460,nop,wscale 8,nop,nop,sackOK], length 0
IP 204.79.197.200.443 > 10.5.14.102.49679: Flags [S.], seq 4028964694, ack 2430004296, win 64240, options [mss 1460], length 0
IP 10.5.14.102.49679 > 204.79.197.200.443: Flags [.], ack 1, win 65535, length 0
IP 10.5.14.102.49679 > 204.79.197.200.443: Flags [P.], seq 1:202, ack 1, win 65535, length 201
IP 204.79.197.200.443 > 10.5.14.102.49679: Flags [.], ack 202, win 64240, length 0
IP 204.79.197.200.443 > 10.5.14.102.49679: Flags [P.], seq 1:1383, ack 202, win 64240, length 1382
IP 204.79.197.200.443 > 10.5.14.102.49679: Flags [P.], seq 1383:2765, ack 202, win 64240, length 1382
IP 10.5.14.102.49679 > 204.79.197.200.443: Flags [.], ack 2765, win 65535, length 0
IP 204.79.197.200.443 > 10.5.14.102.49679: Flags [P.], seq 2765:4147, ack 202, win 64240, length 1382
IP 204.79.197.200.443 > 10.5.14.102.49679: Flags [P.], seq 4147:5529, ack 202, win 64240, length 1382
IP 10.5.14.102.49679 > 204.79.197.200.443: Flags [.], ack 5529, win 65535, length 0
IP 204.79.197.200.443 > 10.5.14.102.49679: Flags [.], seq 5529:6989, ack 202, win 64240, length 1460
IP 204.79.197.200.443 > 10.5.14.102.49679: Flags [P.], seq 6989:7375, ack 202, win 64240, length 386
IP 10.5.14.102.49679 > 204.79.197.200.443: Flags [.], ack 7375, win 65535, length 0
IP 10.5.14.102.49679 > 204.79.197.200.443: Flags [P.], seq 202:360, ack 7375, win 65535, length 158
IP 204.79.197.200.443 > 10.5.14.102.49679: Flags [.], ack 360, win 64240, length 0
IP 10.5.14.102.49679 > 204.79.197.200.443: Flags [P.], seq 360:447, ack 7375, win 65535, length 87
IP 204.79.197.200.443 > 10.5.14.102.49679: Flags [.], ack 447, win 64240, length 0
IP 10.5.14.102.49679 > 204.79.197.200.443: Flags [.], seq 447:1907, ack 7375, win 65535, length 1460
IP 10.5.14.102.49679 > 204.79.197.200.443: Flags [P.], seq 1907:2556, ack 7375, win 65535, length 649
IP 204.79.197.200.443 > 10.5.14.102.49679: Flags [.], ack 1907, win 64240, length 0
IP 204.79.197.200.443 > 10.5.14.102.49679: Flags [.], ack 2556, win 64240, length 0
IP 204.79.197.200.443 > 10.5.14.102.49679: Flags [P.], seq 7375:7770, ack 2556, win 64240, length 395
IP 10.5.14.102.49679 > 204.79.197.200.443: Flags [.], ack 7770, win 65535, length 0
IP 10.5.14.102.49679 > 204.79.197.200.443: Flags [P.], seq 2556:2594, ack 7770, win 65535, length 38
IP 204.79.197.200.443 > 10.5.14.102.49679: Flags [.], ack 2594, win 64240, length 0
IP 204.79.197.200.443 > 10.5.14.102.49679: Flags [P.], seq 7770:7808, ack 2594, win 64240, length 38
IP 10.5.14.102.49679 > 204.79.197.200.443: Flags [.], ack 7808, win 65535, length 0
IP 204.79.197.200.443 > 10.5.14.102.49679: Flags [P.], seq 7808:8613, ack 2594, win 64240, length 805
IP 204.79.197.200.443 > 10.5.14.102.49679: Flags [P.], seq 8613:9995, ack 2594, win 64240, length 1382
IP 10.5.14.102.49679 > 204.79.197.200.443: Flags [.], ack 9995, win 65535, length 0
IP 204.79.197.200.443 > 10.5.14.102.49679: Flags [P.], seq 9995:11377, ack 2594, win 64240, length 1382
IP 10.5.14.102.49679 > 204.79.197.200.443: Flags [.], ack 11377, win 65535, length 0
IP 204.79.197.200.443 > 10.5.14.102.49679: Flags [.], seq 11377:12837, ack 2594, win 64240, length 1460
IP 204.79.197.200.443 > 10.5.14.102.49679: Flags [.], seq 12837:14297, ack 2594, win 64240, length 1460
IP 204.79.197.200.443 > 10.5.14.102.49679: Flags [P.], seq 14297:14483, ack 2594, win 64240, length 186
IP 10.5.14.102.49679 > 204.79.197.200.443: Flags [.], ack 14483, win 65535, length 0
IP 10.5.14.102.52717 > 10.5.14.1.53: 54992+ A? self.events.data.microsoft.com. (48)
IP 10.5.14.1.53 > 10.5.14.102.52717: 54992 3/0/0 CNAME global.asimov.events.data.trafficmanager.net., CNAME skypedataprdcolcus14.cloudapp.net., A 40.78.128.150 (166)
IP 10.5.14.102.49680 > 40.78.128.150.443: Flags [S], seq 1330050031, win 65535, options [mss 1460,nop,wscale 8,nop,nop,sackOK], length 0
IP 40.78.128.150.443 > 10.5.14.102.49680: Flags [S.], seq 2911013589, ack 1330050032, win 64240, options [mss 1460], length 0
IP 10.5.14.102.49680 > 40.78.128.150.443: Flags [.], ack 1, win 65535, length 0
IP 10.5.14.102.49680 > 40.78.128.150.443: Flags [P.], seq 1:192, ack 1, win 65535, length 191
IP 40.78.128.150.443 > 10.5.14.102.49680: Flags [.], ack 192, win 64240, length 0
IP 10.5.14.102.49675 > 204.79.197.200.443: Flags [P.], seq 3262:3725, ack 48488, win 65535, length 463
IP 204.79.197.200.443 > 10.5.14.102.49675: Flags [.], ack 3725, win 64240, length 0
IP 10.5.14.102.49675 > 204.79.197.200.443: Flags [.], seq 3725:5185, ack 48488, win 65535, length 1460
IP 10.5.14.102.49675 > 204.79.197.200.443: Flags [.], seq 5185:6645, ack 48488, win 65535, length 1460
IP 10.5.14.102.49675 > 204.79.197.200.443: Flags [P.], seq 6645:7911, ack 48488, win 65535, length 1266
IP 204.79.197.200.443 > 10.5.14.102.49675: Flags [.], ack 5185, win 64240, length 0
IP 204.79.197.200.443 > 10.5.14.102.49675: Flags [.], ack 6645, win 64240, length 0
IP 10.5.14.102.49675 > 204.79.197.200.443: Flags [P.], seq 7911:7949, ack 48488, win 65535, length 38
IP 204.79.197.200.443 > 10.5.14.102.49675: Flags [.], ack 7911, win 64240, length 0
IP 204.79.197.200.443 > 10.5.14.102.49675: Flags [.], ack 7949, win 64240, length 0
IP 40.78.128.150.443 > 10.5.14.102.49680: Flags [.], seq 1:1461, ack 192, win 64240, length 1460
IP 40.78.128.150.443 > 10.5.14.102.49680: Flags [.], seq 1461:2921, ack 192, win 64240, length 1460
IP 40.78.128.150.443 > 10.5.14.102.49680: Flags [P.], seq 2921:4111, ack 192, win 64240, length 1190
IP 40.78.128.150.443 > 10.5.14.102.49680: Flags [P.], seq 4111:5481, ack 192, win 64240, length 1370
IP 10.5.14.102.49680 > 40.78.128.150.443: Flags [.], ack 5481, win 65535, length 0
IP 40.78.128.150.443 > 10.5.14.102.49680: Flags [P.], seq 5481:6091, ack 192, win 64240, length 610
IP 10.5.14.102.49680 > 40.78.128.150.443: Flags [.], ack 6091, win 65535, length 0
IP 10.5.14.102.49680 > 40.78.128.150.443: Flags [P.], seq 192:285, ack 6091, win 65535, length 93
IP 40.78.128.150.443 > 10.5.14.102.49680: Flags [.], ack 285, win 64240, length 0
IP 40.78.128.150.443 > 10.5.14.102.49680: Flags [P.], seq 6091:6142, ack 285, win 64240, length 51
IP 10.5.14.102.49680 > 40.78.128.150.443: Flags [.], ack 6142, win 65535, length 0
IP 10.5.14.102.49680 > 40.78.128.150.443: Flags [P.], seq 285:1143, ack 6142, win 65535, length 858
IP 40.78.128.150.443 > 10.5.14.102.49680: Flags [.], ack 1143, win 64240, length 0
IP 10.5.14.102.49680 > 40.78.128.150.443: Flags [.], seq 1143:2603, ack 6142, win 65535, length 1460
IP 10.5.14.102.49680 > 40.78.128.150.443: Flags [P.], seq 2603:2683, ack 6142, win 65535, length 80
IP 40.78.128.150.443 > 10.5.14.102.49680: Flags [.], ack 2603, win 64240, length 0
IP 40.78.128.150.443 > 10.5.14.102.49680: Flags [.], ack 2683, win 64240, length 0
IP 204.79.197.200.443 > 10.5.14.102.49675: Flags [P.], seq 48488:48629, ack 7949, win 64240, length 141
IP 10.5.14.102.49675 > 204.79.197.200.443: Flags [.], ack 48629, win 65535, length 0
IP 40.78.128.150.443 > 10.5.14.102.49680: Flags [P.], seq 6142:6196, ack 2683, win 64240, length 54
IP 10.5.14.102.49680 > 40.78.128.150.443: Flags [.], ack 6196, win 65535, length 0
IP 40.78.128.150.443 > 10.5.14.102.49680: Flags [P.], seq 6196:6554, ack 2683, win 64240, length 358
IP 10.5.14.102.49680 > 40.78.128.150.443: Flags [.], ack 6554, win 65535, length 0
IP 10.5.14.102.49675 > 204.79.197.200.443: Flags [P.], seq 7949:8200, ack 48629, win 65535, length 251
IP 204.79.197.200.443 > 10.5.14.102.49675: Flags [.], ack 8200, win 64240, length 0
IP 10.5.14.102.49675 > 204.79.197.200.443: Flags [P.], seq 8200:8923, ack 48629, win 65535, length 723
IP 204.79.197.200.443 > 10.5.14.102.49675: Flags [.], ack 8923, win 64240, length 0
IP 10.5.14.102.49675 > 204.79.197.200.443: Flags [P.], seq 8923:8961, ack 48629, win 65535, length 38
IP 204.79.197.200.443 > 10.5.14.102.49675: Flags [.], ack 8961, win 64240, length 0
IP 10.5.14.102.58876 > 10.5.14.1.53: 58537+ A? wpad.localdomain. (34)
IP 204.79.197.200.443 > 10.5.14.102.49675: Flags [P.], seq 48629:48770, ack 8961, win 64240, length 141
IP 10.5.14.102.49675 > 204.79.197.200.443: Flags [.], ack 48770, win 65535, length 0
IP 10.5.14.102.58876 > 10.5.14.1.53: 58537+ A? wpad.localdomain. (34)
IP 10.5.14.102.58876 > 10.5.14.1.53: 58537+ A? wpad.localdomain. (34)
IP 10.5.14.102.55963 > 10.5.14.1.53: 41243+ A? self.events.data.microsoft.com. (48)
IP 10.5.14.1.53 > 10.5.14.102.55963: 41243 3/0/0 CNAME global.asimov.events.data.trafficmanager.net., CNAME skypedataprdcolcus03.cloudapp.net., A 52.114.128.10 (166)
IP 10.5.14.102.53796 > 10.5.14.1.53: 40785+ A? wpad.localdomain. (34)
IP 10.5.14.102.53797 > 239.255.255.250.1900: UDP, length 173
IP 10.5.14.102.53796 > 10.5.14.1.53: 40785+ A? wpad.localdomain. (34)
IP 10.5.14.102.50018 > 10.5.14.1.53: 56574+ A? www.all-pro-handel.de. (39)
IP 10.5.14.102.53797 > 239.255.255.250.1900: UDP, length 173
IP 10.5.14.1.53 > 10.5.14.102.50018: 56574 1/0/0 A 67.225.205.100 (55)
IP 10.5.14.102.49681 > 67.225.205.100.80: Flags [S], seq 1161408766, win 64240, options [mss 1460,nop,wscale 8,nop,nop,sackOK], length 0
IP 10.5.14.102.49682 > 67.225.205.100.80: Flags [S], seq 264527939, win 64240, options [mss 1460,nop,wscale 8,nop,nop,sackOK], length 0
IP 10.5.14.102.49683 > 67.225.205.100.80: Flags [S], seq 326195376, win 64240, options [mss 1460,nop,wscale 8,nop,nop,sackOK], length 0
IP 67.225.205.100.80 > 10.5.14.102.49682: Flags [S.], seq 2445353127, ack 264527940, win 64240, options [mss 1460], length 0
IP 67.225.205.100.80 > 10.5.14.102.49681: Flags [S.], seq 2482296702, ack 1161408767, win 64240, options [mss 1460], length 0
IP 10.5.14.102.49682 > 67.225.205.100.80: Flags [.], ack 1, win 64240, length 0
IP 10.5.14.102.49681 > 67.225.205.100.80: Flags [.], ack 1, win 64240, length 0
IP 10.5.14.102.49682 > 67.225.205.100.80: Flags [P.], seq 1:509, ack 1, win 64240, length 508: HTTP: GET /wp-content/plugins/all-in-one-seo-pack/modules/images/field.php HTTP/1.1
IP 67.225.205.100.80 > 10.5.14.102.49682: Flags [.], ack 509, win 64240, length 0
IP 67.225.205.100.80 > 10.5.14.102.49683: Flags [S.], seq 1595450352, ack 326195377, win 64240, options [mss 1460], length 0
IP 10.5.14.102.49683 > 67.225.205.100.80: Flags [.], ack 1, win 64240, length 0
IP 10.5.14.102.53797 > 239.255.255.250.1900: UDP, length 173
IP 67.225.205.100.80 > 10.5.14.102.49682: Flags [FP.], seq 1:653, ack 509, win 64240, length 652: HTTP: HTTP/1.1 302 Found
IP 10.5.14.102.49682 > 67.225.205.100.80: Flags [.], ack 654, win 63588, length 0
IP 10.5.14.102.49682 > 67.225.205.100.80: Flags [F.], seq 509, ack 654, win 63588, length 0
IP 67.225.205.100.80 > 10.5.14.102.49682: Flags [.], ack 510, win 64239, length 0
IP 10.5.14.102.64535 > 10.5.14.1.53: 41758+ A? www.sanmamiliano.com. (38)
